{
  "system": "CreditSightScore",
  "regulation": "Regulation (EU) 2024/1689 of the European Parliament and of the Council of 13 June 2024 (Artificial Intelligence Act), OJ L, 2024/1689, 12.7.2024",
  "risk_tier": "high_risk",
  "disposition": "determined",
  "scope": {
    "status": "in_scope",
    "is_ai_system": true,
    "intended_purpose_source": "",
    "eu_nexus": true,
    "excluded_use_flags": [],
    "transitional_status": "No transitional limitation identified from the submitted facts.",
    "notes": []
  },
  "roles": [
    "provider"
  ],
  "is_gpai": false,
  "gpai_systemic": false,
  "findings": [
    {
      "rule_id": "HIGHRISK.III.5.b",
      "citation": "Annex III(5)(b) AIA",
      "citation_verified": true,
      "title": "High-risk: Creditworthiness evaluation and credit scoring of natural persons",
      "detail": "Annex III high-risk area (Art. 6(2) AIA); no derogation asserted.",
      "severity": "high",
      "tier": "high_risk"
    }
  ],
  "obligations": [
    {
      "article": "Art. 9 AIA",
      "citation_verified": true,
      "title": "Risk management system",
      "applies_to": "provider",
      "requirement": "Establish, document and maintain a continuous risk management system."
    },
    {
      "article": "Art. 10 AIA",
      "citation_verified": true,
      "title": "Data and data governance",
      "applies_to": "provider",
      "requirement": "Apply data governance to training, validation and testing data sets."
    },
    {
      "article": "Art. 11 AIA",
      "citation_verified": true,
      "title": "Technical documentation",
      "applies_to": "provider",
      "requirement": "Draw up technical documentation (Annex IV) before placing on the market."
    },
    {
      "article": "Art. 12 AIA",
      "citation_verified": true,
      "title": "Record-keeping (logging)",
      "applies_to": "provider",
      "requirement": "Enable automatic recording of events (logs) over the system's lifetime."
    },
    {
      "article": "Art. 13 AIA",
      "citation_verified": true,
      "title": "Transparency to deployers",
      "applies_to": "provider",
      "requirement": "Provide instructions for use enabling deployers to comply."
    },
    {
      "article": "Art. 14 AIA",
      "citation_verified": true,
      "title": "Human oversight",
      "applies_to": "provider",
      "requirement": "Design the system for effective oversight by natural persons."
    },
    {
      "article": "Art. 15 AIA",
      "citation_verified": true,
      "title": "Accuracy, robustness, cybersecurity",
      "applies_to": "provider",
      "requirement": "Achieve appropriate accuracy, robustness and cybersecurity."
    },
    {
      "article": "Art. 17 AIA",
      "citation_verified": true,
      "title": "Quality management system",
      "applies_to": "provider",
      "requirement": "Put a quality management system in place."
    },
    {
      "article": "Art. 43 AIA",
      "citation_verified": true,
      "title": "Conformity assessment",
      "applies_to": "provider",
      "requirement": "Undergo the applicable conformity assessment before market placement."
    },
    {
      "article": "Art. 47 AIA",
      "citation_verified": true,
      "title": "EU declaration of conformity",
      "applies_to": "provider",
      "requirement": "Draw up and keep an EU declaration of conformity."
    },
    {
      "article": "Art. 48 AIA",
      "citation_verified": true,
      "title": "CE marking",
      "applies_to": "provider",
      "requirement": "Affix the CE marking to indicate conformity."
    },
    {
      "article": "Art. 49 AIA",
      "citation_verified": true,
      "title": "Registration",
      "applies_to": "provider",
      "requirement": "Register the system in the EU database before market placement."
    },
    {
      "article": "Art. 72 AIA",
      "citation_verified": true,
      "title": "Post-market monitoring",
      "applies_to": "provider",
      "requirement": "Operate a post-market monitoring system."
    },
    {
      "article": "Art. 73 AIA",
      "citation_verified": true,
      "title": "Serious incident reporting",
      "applies_to": "provider",
      "requirement": "Report serious incidents to the market surveillance authority."
    }
  ],
  "documentation_required": [
    {
      "article": "Art. 11 AIA + Annex IV",
      "citation_verified": true,
      "title": "Technical documentation",
      "applies_to": "provider",
      "requirement": "Annex IV technical documentation, kept current."
    },
    {
      "article": "Art. 9 AIA",
      "citation_verified": true,
      "title": "Risk management file",
      "applies_to": "provider",
      "requirement": "Documented risk management system and its results."
    },
    {
      "article": "Art. 13 AIA",
      "citation_verified": true,
      "title": "Instructions for use",
      "applies_to": "provider",
      "requirement": "Instructions enabling deployer compliance."
    },
    {
      "article": "Art. 17 AIA",
      "citation_verified": true,
      "title": "QMS documentation",
      "applies_to": "provider",
      "requirement": "Written quality management system policies and procedures."
    },
    {
      "article": "Art. 47 AIA",
      "citation_verified": true,
      "title": "EU declaration of conformity",
      "applies_to": "provider",
      "requirement": "Signed EU declaration of conformity."
    }
  ],
  "transparency_obligations": [],
  "obligation_graph": [
    {
      "obligation_id": "high-risk.provider.16",
      "article": "Art. 16 AIA",
      "actor": "provider",
      "trigger": "Provider of a high-risk AI system.",
      "requirement": "Ensure the high-risk system complies with Chapter III requirements.",
      "evidence_artifact": "Provider compliance responsibility matrix.",
      "source_status": "binding_level_1",
      "source_url": "https://eur-lex.europa.eu/eli/reg/2024/1689/2026-07-27/eng",
      "application_date": "2027-12-02",
      "review_status": "determined"
    },
    {
      "obligation_id": "high-risk.provider.17",
      "article": "Art. 17 AIA",
      "actor": "provider",
      "trigger": "Provider of a high-risk AI system.",
      "requirement": "Maintain a quality management system.",
      "evidence_artifact": "Quality management system file.",
      "source_status": "binding_level_1",
      "source_url": "https://eur-lex.europa.eu/eli/reg/2024/1689/2026-07-27/eng",
      "application_date": "2027-12-02",
      "review_status": "determined"
    },
    {
      "obligation_id": "high-risk.provider.18",
      "article": "Art. 18 AIA",
      "actor": "provider",
      "trigger": "Provider of a high-risk AI system.",
      "requirement": "Keep technical documentation, logs and conformity documentation.",
      "evidence_artifact": "Document retention register.",
      "source_status": "binding_level_1",
      "source_url": "https://eur-lex.europa.eu/eli/reg/2024/1689/2026-07-27/eng",
      "application_date": "2027-12-02",
      "review_status": "determined"
    },
    {
      "obligation_id": "high-risk.provider.19",
      "article": "Art. 19 AIA",
      "actor": "provider",
      "trigger": "Provider of a high-risk AI system.",
      "requirement": "Keep automatically generated logs where under provider control.",
      "evidence_artifact": "Logging retention policy.",
      "source_status": "binding_level_1",
      "source_url": "https://eur-lex.europa.eu/eli/reg/2024/1689/2026-07-27/eng",
      "application_date": "2027-12-02",
      "review_status": "determined"
    },
    {
      "obligation_id": "high-risk.provider.20",
      "article": "Art. 20 AIA",
      "actor": "provider",
      "trigger": "Risk or nonconformity after placing on the market.",
      "requirement": "Take corrective action and inform relevant parties where required.",
      "evidence_artifact": "Corrective-action and notification log.",
      "source_status": "binding_level_1",
      "source_url": "https://eur-lex.europa.eu/eli/reg/2024/1689/2026-07-27/eng",
      "application_date": "2027-12-02",
      "review_status": "review_required"
    },
    {
      "obligation_id": "high-risk.provider.21",
      "article": "Art. 21 AIA",
      "actor": "provider",
      "trigger": "Competent-authority request.",
      "requirement": "Cooperate with competent authorities and provide requested information.",
      "evidence_artifact": "Authority cooperation protocol.",
      "source_status": "binding_level_1",
      "source_url": "https://eur-lex.europa.eu/eli/reg/2024/1689/2026-07-27/eng",
      "application_date": "2027-12-02",
      "review_status": "review_required"
    },
    {
      "obligation_id": "high-risk.provider.40",
      "article": "Art. 40 AIA",
      "actor": "provider",
      "trigger": "High-risk requirements where harmonised standards are available.",
      "requirement": "Track applicable harmonised standards and standardisation deliverables.",
      "evidence_artifact": "Standards applicability matrix.",
      "source_status": "binding_level_1",
      "source_url": "https://eur-lex.europa.eu/eli/reg/2024/1689/2026-07-27/eng",
      "application_date": "2027-12-02",
      "review_status": "review_required"
    },
    {
      "obligation_id": "high-risk.provider.41",
      "article": "Art. 41 AIA",
      "actor": "provider",
      "trigger": "Common specifications become applicable.",
      "requirement": "Assess common specifications where harmonised standards are unavailable or insufficient.",
      "evidence_artifact": "Common specifications assessment.",
      "source_status": "binding_level_1",
      "source_url": "https://eur-lex.europa.eu/eli/reg/2024/1689/2026-07-27/eng",
      "application_date": "2027-12-02",
      "review_status": "review_required"
    },
    {
      "obligation_id": "high-risk.provider.42",
      "article": "Art. 42 AIA",
      "actor": "provider",
      "trigger": "Use of standards or specifications for presumption of conformity.",